{
  "kind": "ReleaseEvidenceIndexGateV1",
  "schemaVersion": 1,
  "generatedAt": "2026-06-11T00:00:00.000Z",
  "ReleaseEvidenceIndexGateV1": true,
  "requiredGates": [
    "release_evidence_index_has_source_hashes",
    "release_evidence_index_has_command_artifacts",
    "release_evidence_index_links_autonomy_gap_ledger",
    "release_evidence_index_links_closure_readiness",
    "release_evidence_index_links_capability_bundle",
    "release_evidence_index_links_ci_pipeline",
    "release_evidence_index_hash_chain_valid",
    "release_evidence_index_secret_free"
  ],
  "evidenceIndex": {
    "kind": "ReleaseEvidenceIndexV1",
    "schemaVersion": 1,
    "releaseId": "repi-release-evidence-fixture",
    "gitHead": "4f7725f",
    "sourceFiles": [
      {
        "path": "package.json",
        "exists": true,
        "sha256": "aaaaaaaaaaaaaaaaaaaaaaaaaaaaaaaaaaaaaaaaaaaaaaaaaaaaaaaaaaaaaaaa",
        "bytes": 100
      },
      {
        "path": "README.md",
        "exists": true,
        "sha256": "bbbbbbbbbbbbbbbbbbbbbbbbbbbbbbbbbbbbbbbbbbbbbbbbbbbbbbbbbbbbbbbb",
        "bytes": 100
      },
      {
        "path": "scripts/reverse-agent/autonomy-control-plane.mjs",
        "exists": true,
        "sha256": "cccccccccccccccccccccccccccccccccccccccccccccccccccccccccccccccc",
        "bytes": 100
      },
      {
        "path": "scripts/reverse-agent/autonomous-closure-readiness-gate.mjs",
        "exists": true,
        "sha256": "dddddddddddddddddddddddddddddddddddddddddddddddddddddddddddddddd",
        "bytes": 100
      },
      {
        "path": "scripts/reverse-agent/capability-release-bundle-gate.mjs",
        "exists": true,
        "sha256": "eeeeeeeeeeeeeeeeeeeeeeeeeeeeeeeeeeeeeeeeeeeeeeeeeeeeeeeeeeeeeeee",
        "bytes": 100
      },
      {
        "path": "scripts/reverse-agent/release-ci-pipeline-gate.mjs",
        "exists": true,
        "sha256": "ffffffffffffffffffffffffffffffffffffffffffffffffffffffffffffffff",
        "bytes": 100
      },
      {
        "path": ".github/workflows/repi-harness.yml",
        "exists": true,
        "sha256": "1111111111111111111111111111111111111111111111111111111111111111",
        "bytes": 100
      },
      {
        "path": "docs/reverse-agent/repi-harness.github-actions.yml",
        "exists": true,
        "sha256": "2222222222222222222222222222222222222222222222222222222222222222",
        "bytes": 100
      }
    ],
    "commandEvidence": [
      {
        "id": "gate:autonomy-control",
        "command": "node scripts/reverse-agent/autonomy-control-plane.mjs . --strict --json",
        "code": 0,
        "stdoutSha256": "3333333333333333333333333333333333333333333333333333333333333333",
        "stderrSha256": "4444444444444444444444444444444444444444444444444444444444444444",
        "parsedKind": "pi-recon-autonomy-control-plane",
        "secretFree": true
      },
      {
        "id": "gate:autonomous-closure-readiness",
        "command": "node scripts/reverse-agent/autonomous-closure-readiness-gate.mjs . --strict --no-write --json",
        "code": 0,
        "stdoutSha256": "5555555555555555555555555555555555555555555555555555555555555555",
        "stderrSha256": "6666666666666666666666666666666666666666666666666666666666666666",
        "parsedKind": "repi-autonomous-closure-readiness-gate",
        "secretFree": true
      },
      {
        "id": "gate:capability-release-bundle",
        "command": "node scripts/reverse-agent/capability-release-bundle-gate.mjs . --strict --no-write --json",
        "code": 0,
        "stdoutSha256": "7777777777777777777777777777777777777777777777777777777777777777",
        "stderrSha256": "8888888888888888888888888888888888888888888888888888888888888888",
        "parsedKind": "repi-capability-release-bundle-gate",
        "secretFree": true
      },
      {
        "id": "gate:release-ci-pipeline",
        "command": "node scripts/reverse-agent/release-ci-pipeline-gate.mjs . --strict --no-write --json",
        "code": 0,
        "stdoutSha256": "9999999999999999999999999999999999999999999999999999999999999999",
        "stderrSha256": "abababababababababababababababababababababababababababababababab",
        "parsedKind": "repi-release-ci-pipeline-gate",
        "secretFree": true
      }
    ],
    "indexRows": [
      {
        "seq": 1,
        "evidenceId": "source:package.json",
        "evidenceType": "source_file",
        "sourceRef": "package.json",
        "sha256": "aaaaaaaaaaaaaaaaaaaaaaaaaaaaaaaaaaaaaaaaaaaaaaaaaaaaaaaaaaaaaaaa",
        "prevHash": "0000000000000000000000000000000000000000000000000000000000000000",
        "rowHash": "a9e2d0d675f984bec43fdd2f6218b84ee2fc0ffe9c9ff0dcca73289926897b8f"
      },
      {
        "seq": 2,
        "evidenceId": "source:README.md",
        "evidenceType": "source_file",
        "sourceRef": "README.md",
        "sha256": "bbbbbbbbbbbbbbbbbbbbbbbbbbbbbbbbbbbbbbbbbbbbbbbbbbbbbbbbbbbbbbbb",
        "prevHash": "a9e2d0d675f984bec43fdd2f6218b84ee2fc0ffe9c9ff0dcca73289926897b8f",
        "rowHash": "a1d778f8be56148672fcb491ffa06d28d6833892ed0c056f7ba80e7f1ade8e50"
      },
      {
        "seq": 3,
        "evidenceId": "source:scripts/reverse-agent/autonomy-control-plane.mjs",
        "evidenceType": "source_file",
        "sourceRef": "scripts/reverse-agent/autonomy-control-plane.mjs",
        "sha256": "cccccccccccccccccccccccccccccccccccccccccccccccccccccccccccccccc",
        "prevHash": "a1d778f8be56148672fcb491ffa06d28d6833892ed0c056f7ba80e7f1ade8e50",
        "rowHash": "0fd76b5ef8db26ecc14a7f324efd086d3fe4026d2cfc0a1004d5a05902567bef"
      },
      {
        "seq": 4,
        "evidenceId": "source:scripts/reverse-agent/autonomous-closure-readiness-gate.mjs",
        "evidenceType": "source_file",
        "sourceRef": "scripts/reverse-agent/autonomous-closure-readiness-gate.mjs",
        "sha256": "dddddddddddddddddddddddddddddddddddddddddddddddddddddddddddddddd",
        "prevHash": "0fd76b5ef8db26ecc14a7f324efd086d3fe4026d2cfc0a1004d5a05902567bef",
        "rowHash": "68e2eb8cfada21b338a9de170d0902c86faa854c2e689100b9c2e198e55d4fa5"
      },
      {
        "seq": 5,
        "evidenceId": "source:scripts/reverse-agent/capability-release-bundle-gate.mjs",
        "evidenceType": "source_file",
        "sourceRef": "scripts/reverse-agent/capability-release-bundle-gate.mjs",
        "sha256": "eeeeeeeeeeeeeeeeeeeeeeeeeeeeeeeeeeeeeeeeeeeeeeeeeeeeeeeeeeeeeeee",
        "prevHash": "68e2eb8cfada21b338a9de170d0902c86faa854c2e689100b9c2e198e55d4fa5",
        "rowHash": "d9f30e621dbfe2061c98f4aaa902c92737ed10d13c6c17538f917b0ed91f16e7"
      },
      {
        "seq": 6,
        "evidenceId": "source:scripts/reverse-agent/release-ci-pipeline-gate.mjs",
        "evidenceType": "source_file",
        "sourceRef": "scripts/reverse-agent/release-ci-pipeline-gate.mjs",
        "sha256": "ffffffffffffffffffffffffffffffffffffffffffffffffffffffffffffffff",
        "prevHash": "d9f30e621dbfe2061c98f4aaa902c92737ed10d13c6c17538f917b0ed91f16e7",
        "rowHash": "176d7c768286905c8a1840a96bb81294eaacf68a360208146b319d0ffaa2fd6c"
      },
      {
        "seq": 7,
        "evidenceId": "source:.github/workflows/repi-harness.yml",
        "evidenceType": "source_file",
        "sourceRef": ".github/workflows/repi-harness.yml",
        "sha256": "1111111111111111111111111111111111111111111111111111111111111111",
        "prevHash": "176d7c768286905c8a1840a96bb81294eaacf68a360208146b319d0ffaa2fd6c",
        "rowHash": "9ba3a18746c45c64cd300b4985f97184c8e688d4be4767b9d7db6c5f6849c3a2"
      },
      {
        "seq": 8,
        "evidenceId": "source:docs/reverse-agent/repi-harness.github-actions.yml",
        "evidenceType": "source_file",
        "sourceRef": "docs/reverse-agent/repi-harness.github-actions.yml",
        "sha256": "2222222222222222222222222222222222222222222222222222222222222222",
        "prevHash": "9ba3a18746c45c64cd300b4985f97184c8e688d4be4767b9d7db6c5f6849c3a2",
        "rowHash": "3fa9f9eb8488bd3ef7d6627828922887dea7c991726f22d75fdf9238da7b7f1e"
      },
      {
        "seq": 9,
        "evidenceId": "cmd:gate:autonomy-control",
        "evidenceType": "command_output",
        "sourceRef": "gate:autonomy-control",
        "sha256": "3333333333333333333333333333333333333333333333333333333333333333",
        "prevHash": "3fa9f9eb8488bd3ef7d6627828922887dea7c991726f22d75fdf9238da7b7f1e",
        "rowHash": "7df2c318a53b6266459ba74d62b72faaaed4ff33bc8a9dc0a3b99eb571aba0eb"
      },
      {
        "seq": 10,
        "evidenceId": "cmd:gate:autonomous-closure-readiness",
        "evidenceType": "command_output",
        "sourceRef": "gate:autonomous-closure-readiness",
        "sha256": "5555555555555555555555555555555555555555555555555555555555555555",
        "prevHash": "7df2c318a53b6266459ba74d62b72faaaed4ff33bc8a9dc0a3b99eb571aba0eb",
        "rowHash": "8618b733fff53be761c862770578cf143e6de571d4caf50d6bf180a228bdeec2"
      },
      {
        "seq": 11,
        "evidenceId": "cmd:gate:capability-release-bundle",
        "evidenceType": "command_output",
        "sourceRef": "gate:capability-release-bundle",
        "sha256": "7777777777777777777777777777777777777777777777777777777777777777",
        "prevHash": "8618b733fff53be761c862770578cf143e6de571d4caf50d6bf180a228bdeec2",
        "rowHash": "64ea61c4e8a1145e33cc28e122a4bb6b383325d8f6c92fc802ca6ef5c40ce84f"
      },
      {
        "seq": 12,
        "evidenceId": "cmd:gate:release-ci-pipeline",
        "evidenceType": "command_output",
        "sourceRef": "gate:release-ci-pipeline",
        "sha256": "9999999999999999999999999999999999999999999999999999999999999999",
        "prevHash": "64ea61c4e8a1145e33cc28e122a4bb6b383325d8f6c92fc802ca6ef5c40ce84f",
        "rowHash": "f4bfae569d222dc0520bf172b82997302505fe013980e6c429f7eacfc7d73cf5"
      },
      {
        "seq": 13,
        "evidenceId": "summary:autonomy-gap-ledger",
        "evidenceType": "parsed_summary",